<?xml version="1.0" encoding="UTF-8"?>
<receta xmlns:xsi="http://www.w3.org/2001/XMLSchema-instance"
    xsi:noNamespaceSchemaLocation="ejemplo2.xsd">

    <titulo>Pollo al ajillo</titulo>
    <ingredientes>Pechugas de Pollo</ingredientes>
    <ingredientes>Ajos</ingredientes>
    <ingredientes>Pimienta</ingredientes>
    <ingredientes>Sal</ingredientes>
    <procedimiento>Sellamos el pollo</procedimiento>
    <procedimiento>Sofries el ajo</procedimiento>
    <procedimiento>Condimentamos con sal y pimienta</procedimiento>
    <procedimiento>AÃ±adimos el pollo</procedimiento>


</receta>